{
  "$schema": "https://json-schema.org/draft/2020-12/schema",
  "title": "Asset Manifest",
  "type": "object",
  "required": ["characters", "scenes", "props"],
  "properties": {
    "naming_policy": { "type": ["string", "null"] },
    "characters": { "$ref": "#/$defs/assets" },
    "scenes": { "$ref": "#/$defs/assets" },
    "props": { "$ref": "#/$defs/assets" }
  },
  "$defs": {
    "assets": {
      "type": "array",
      "items": {
        "type": "object",
        "required": ["asset_name", "asset_type", "appears_in_shots", "generation_required"],
        "properties": {
          "asset_name": { "type": "string" },
          "asset_type": { "type": "string", "enum": ["character", "scene", "prop"] },
          "naming_strategy": {
            "type": ["string", "null"],
            "enum": ["numbered_subject", "custom_concrete_name", "simple_scene_number", "concrete_scene_name", "key_prop_name", null]
          },
          "seedance_label": { "type": ["string", "null"] },
          "definition_sentence": { "type": ["string", "null"] },
          "reference_bindings": {
            "type": ["array", "null"],
            "items": {
              "type": "object",
              "properties": {
                "source_id": { "type": "string" },
                "source_type": { "type": "string", "enum": ["image", "video", "generated_asset", "text_only"] },
                "role": { "type": "string" },
                "notes": { "type": ["string", "null"] }
              }
            }
          },
          "base_name": { "type": ["string", "null"] },
          "feature": { "type": ["string", "null"] },
          "state": { "type": ["string", "null"] },
          "angle_or_view": { "type": ["string", "null"] },
          "visual_anchors": { "type": ["array", "string", "null"], "items": { "type": "string" } },
          "appears_in_shots": { "type": "array", "items": { "type": "string" } },
          "generation_required": { "type": ["boolean", "string"] },
          "required_reference_set": {
            "type": ["array", "null"],
            "items": {
              "type": "string",
              "enum": ["face_closeup", "full_body_styling", "scene_reference", "backup_lighting_reference", "independent_prop_reference"]
            }
          },
          "prompt_scope": {
            "type": ["string", "null"],
            "enum": [
              "single_character_identity_bundle",
              "single_scene_reference",
              "single_prop_reference",
              "text_control_only",
              "inherited_from_reference",
              null
            ]
          },
          "handling_policy": {
            "type": ["string", "null"],
            "enum": [
              "bind_existing_reference",
              "generate_identity_bundle",
              "generate_scene_reference",
              "text_prompt_control",
              "inherit_from_reference",
              "remove_by_instruction",
              "generate_independent_prop",
              null
            ]
          },
          "notes": { "type": ["string", "null"] }
        }
      }
    }
  }
}
